{
  "model": null,
  "constraints": {
    "exact_k": 2,
    "k_min": 0,
    "k_max": null,
    "budget": 5,
    "mandatory": [
      0
    ],
    "forbidden": [],
    "coverage_groups": [
      [
        2,
        4
      ]
    ],
    "exclude_empty": true,
    "exclude_full": true
  },
  "activation_costs": [
    1,
    2,
    1,
    3,
    1
  ],
  "cut_weights": [
    [
      0,
      1,
      0,
      0,
      0
    ],
    [
      2,
      0,
      3,
      0,
      0
    ],
    [
      0,
      0,
      0,
      0,
      0
    ],
    [
      0,
      0,
      0,
      0,
      4
    ],
    [
      0,
      0,
      0,
      0,
      0
    ]
  ],
  "information_weight": 1.0,
  "cost_weight": 0.0,
  "metadata": {
    "purpose": "private Phase XLII example",
    "cost_tier": "E0"
  }
}
